train,stations
train_0,"[Hoorn, Alkmaar, Castricum, Zaandam, Amsterdam Sloterdijk, Amsterdam Centraal, Amsterdam Amstel, Amsterdam Zuid, Schiphol Airport, Leiden Centraal, Den Haag Centraal, Delft]"
train_1,"[Schiedam Centrum, Rotterdam Centraal, Rotterdam Alexander, Gouda, Den Haag Centraal, Delft, Schiedam Centrum, Rotterdam Centraal, Dordrecht]"
train_2,"[Leiden Centraal, Heemstede-Aerdenhout, Haarlem, Amsterdam Sloterdijk, Amsterdam Zuid, Schiphol Airport]"
train_3,"[Rotterdam Alexander, Rotterdam Centraal]"
train_4,"[Heemstede-Aerdenhout, Haarlem, Beverwijk, Castricum, Zaandam, Beverwijk, Castricum, Zaandam, Hoorn]"
train_5,"[Gouda, Alphen a/d Rijn, Leiden Centraal, Den Haag Centraal]"
train_6,"[Dordrecht, Rotterdam Centraal, Rotterdam Alexander]"
score,8167.714285714286
