train,stations
train_0,"[Dordrecht, Rotterdam Centraal, Rotterdam Alexander, Gouda, Alphen a/d Rijn, Leiden Centraal, Schiphol Airport, Amsterdam Zuid, Amsterdam Sloterdijk, Haarlem, Beverwijk]"
train_1,"[Schiphol Airport, Amsterdam Zuid, Amsterdam Amstel, Amsterdam Centraal, Amsterdam Sloterdijk, Zaandam, Hoorn, Alkmaar, Den Helder]"
train_2,"[Castricum, Beverwijk, Haarlem, Heemstede-Aerdenhout, Leiden Centraal, Den Haag Centraal, Delft, Schiedam Centrum, Rotterdam Centraal, Dordrecht, Rotterdam Centraal, Dordrecht]"
train_3,"[Den Helder, Alkmaar, Castricum, Zaandam, Beverwijk, Zaandam, Beverwijk]"
score,9172.0
