train,stations
train_0,"[Alkmaar, Den Helder, Alkmaar, Hoorn]"
train_1,"[Amsterdam Zuid, Schiphol Airport, Leiden Centraal, Alphen a/d Rijn, Gouda, Rotterdam Alexander, Rotterdam Centraal, Dordrecht, Rotterdam Centraal, Schiedam Centrum, Delft]"
train_2,"[Castricum, Alkmaar, Hoorn, Zaandam, Castricum, Beverwijk, Zaandam, Amsterdam Sloterdijk]"
train_3,"[Beverwijk, Haarlem, Amsterdam Sloterdijk, Amsterdam Centraal, Amsterdam Amstel, Amsterdam Zuid, Amsterdam Sloterdijk, Haarlem, Heemstede-Aerdenhout, Leiden Centraal, Den Haag Centraal]"
score,9162.0
